{"extensions":{},"immutable":false,"mncs_version":"0.2","records":[{"contract_id":"example.identity.v1","id":"contract","kind":"contract","media_type":"text/markdown","path":"specification/contract.md","sha256":"sha256:7542157286ee3659296a2f61ba73e0ec28213a97cfbc1e53658dadfac87c469d"},{"contract_id":"example.identity.v1","id":"reference","kind":"reference","media_type":"text/x-python","path":"reference/reference.py","sha256":"sha256:aa5b31e0378979ef57631bd8106ba75a5ce3e5f4147f061ce8b0c50169b22701"},{"candidate_source_hash":"sha256:73bd1519e7a6bdc6e4955ce4451ae1eb588a58606c4cf5670c1c164d354678ae","contract_id":"example.identity.v1","id":"machine","kind":"machine","media_type":"text/x-python","path":"machine/generated.py","sha256":"sha256:73bd1519e7a6bdc6e4955ce4451ae1eb588a58606c4cf5670c1c164d354678ae"},{"candidate_source_hash":"sha256:73bd1519e7a6bdc6e4955ce4451ae1eb588a58606c4cf5670c1c164d354678ae","contract_id":"example.identity.v1","id":"identity-generator","kind":"identity","media_type":"application/json","path":"evidence/identities/identity-generator.json","sha256":"sha256:119ffdc06e0cc9e2e07e9daa393063ae1545274847e63b2a5f50719dc6d91be7"},{"candidate_source_hash":"sha256:73bd1519e7a6bdc6e4955ce4451ae1eb588a58606c4cf5670c1c164d354678ae","contract_id":"example.identity.v1","id":"identity-evaluator","kind":"identity","media_type":"application/json","path":"evidence/identities/identity-evaluator.json","sha256":"sha256:8c6dcf0b337eba166957055f8e0fceab18b864868f1a7274f65f5247afbb57f8"},{"candidate_source_hash":"sha256:73bd1519e7a6bdc6e4955ce4451ae1eb588a58606c4cf5670c1c164d354678ae","contract_id":"example.identity.v1","id":"identity-environment","kind":"identity","media_type":"application/json","path":"evidence/identities/identity-environment.json","sha256":"sha256:bec2072576f16c4fc1cb89d286b8a29b8035f5e83b6b946c4180b7928dbc1679"},{"candidate_source_hash":"sha256:73bd1519e7a6bdc6e4955ce4451ae1eb588a58606c4cf5670c1c164d354678ae","contract_id":"example.identity.v1","id":"identity-toolchain","kind":"identity","media_type":"application/json","path":"evidence/identities/identity-toolchain.json","sha256":"sha256:af20ea500a0e354d5bb8bed2242e583c35f65e682398a4e931c73ec85466a4fc"},{"candidate_source_hash":"sha256:73bd1519e7a6bdc6e4955ce4451ae1eb588a58606c4cf5670c1c164d354678ae","contract_id":"example.identity.v1","id":"gate-behavioral","kind":"gate_result","media_type":"application/json","path":"evidence/gate-behavioral.json","sha256":"sha256:3b7ced95d46166578c00b7d7c08f581c3561ea9bdcb3891baa2082597380cbb9"},{"candidate_source_hash":"sha256:73bd1519e7a6bdc6e4955ce4451ae1eb588a58606c4cf5670c1c164d354678ae","contract_id":"example.identity.v1","id":"gate-compiler_matrix","kind":"gate_result","media_type":"application/json","path":"evidence/gate-compiler_matrix.json","sha256":"sha256:5b987a390e8750e5b48508fe1d10751f2b87a3373db3760009be42c7c3c81fa1"},{"candidate_source_hash":"sha256:73bd1519e7a6bdc6e4955ce4451ae1eb588a58606c4cf5670c1c164d354678ae","contract_id":"example.identity.v1","id":"provenance-primary","kind":"provenance","media_type":"application/json","path":"provenance/provenance.json","sha256":"sha256:0c9813f16f860c891909605c362260ce83880613c75aeec7a8458a2cbd1476ee"}],"schema_version":"0.2","unreferenced_evidence_policy":"warn"}
